{
  "schema_version": "1.0.0",
  "content_version": "0.1.1",
  "practice_set_id": "cpk_sg_seab_h2_math_9758_2026",
  "framework_id": "cfw_sg_seab_h2_math_9758_2026_outcomes",
  "curriculum_id": "cur_sg_seab_h2_math_9758_2026",
  "subject": "Mathematics",
  "source_ids": [
    "src_sg_seab_h2_math_9758_2026"
  ],
  "generated_at": "2026-07-19",
  "review_status": "approved",
  "changelog": [
    {
      "version": "0.1.0",
      "date": "2026-07-19",
      "summary_zh": "将 6 项图形计算器、软件操作和作答证据要求从概念掌握度分流到教学与评测知识层。"
    },
    {
      "version": "0.1.1",
      "date": "2026-10-25",
      "summary_zh": "完成联网复核与人工批准。"
    }
  ],
  "items": [
    {
      "practice_id": "practice_sg_h2_math_9758_2026_gc_evidence_limitations",
      "requirement_ids": [
        "req_sg_h2_math_9758_2026_o_gc_evidence_limitations"
      ],
      "kind": "assessment_task",
      "name": "Graphing-calculator evidence and limitations",
      "name_zh": "图形计算器证据与局限",
      "description_zh": "正确使用获准图形计算器，识别精度和显示限制，并在题目要求时提交数学步骤或图像草图。",
      "instructional_use_zh": "在首次使用图形计算器前明确显示窗口、数值精度、追踪误差与 unsupported answer 规则；要求学习者用草图或数学步骤支撑关键结论。",
      "assessment_evidence_zh": "工具输出与题目要求一致；必要步骤、图像草图、精度说明和局限判断齐全，且不会把追踪值误报为精确根。",
      "evidence_refs": [
        {
          "source_id": "src_sg_seab_h2_math_9758_2026",
          "locator": "PDF p.4, Use of a Graphing Calculator"
        }
      ],
      "review_status": "approved"
    },
    {
      "practice_id": "practice_sg_h2_math_9758_2026_graphing_function_technology",
      "requirement_ids": [
        "req_sg_h2_math_9758_2026_o_graphing_function_technology"
      ],
      "kind": "assessment_task",
      "name": "Graphing functions with technology",
      "name_zh": "使用图形技术绘制函数",
      "description_zh": "使用图形计算器或绘图软件绘制给定函数，并保留能支持结论的图像信息。",
      "instructional_use_zh": "让学习者先预测定义域、关键点和渐近行为，再设置窗口绘图，并用代数或特征检查图像是否可信。",
      "assessment_evidence_zh": "图像窗口合适，关键特征可见；草图标注截距、转折点或渐近线，并能说明图像与函数表达式一致。",
      "evidence_refs": [
        {
          "source_id": "src_sg_seab_h2_math_9758_2026",
          "locator": "PDF p.6, sub-topic 1.2 Graphs and transformations"
        }
      ],
      "review_status": "approved"
    },
    {
      "practice_id": "practice_sg_h2_math_9758_2026_gc_equation_solving",
      "requirement_ids": [
        "req_sg_h2_math_9758_2026_o_gc_equation_solving"
      ],
      "kind": "assessment_task",
      "name": "Equation solving with graphing technology",
      "name_zh": "使用图形技术求解方程与方程组",
      "description_zh": "用图形计算器或软件精确或近似求解方程与线性方程组，并保留必要数学依据。",
      "instructional_use_zh": "把图形交点或零点作为近似求解方法，同时要求学习者记录所绘函数、搜索区间、精度及可能漏根的检查。",
      "assessment_evidence_zh": "给出所用图像或方程、全部相关交点或零点、适当精度和必要数学依据；窗口限制不会导致静默漏解。",
      "evidence_refs": [
        {
          "source_id": "src_sg_seab_h2_math_9758_2026",
          "locator": "PDF p.7, sub-topic 1.3 Equations and inequalities"
        }
      ],
      "review_status": "approved"
    },
    {
      "practice_id": "practice_sg_h2_math_9758_2026_recurrence_technology",
      "requirement_ids": [
        "req_sg_h2_math_9758_2026_o_recurrence_technology"
      ],
      "kind": "assessment_task",
      "name": "Generating recurrence sequences with technology",
      "name_zh": "使用技术生成递推数列",
      "description_zh": "使用图形计算器或程序按递推关系生成数列并检查项值。",
      "instructional_use_zh": "要求学习者先写清初值与递推规则，再用序列模式或程序生成项，并用手算前几项核验索引和实现。",
      "assessment_evidence_zh": "初值、递推式、索引范围和生成结果一致；至少有若干手算项或独立检查证明工具配置无偏移。",
      "evidence_refs": [
        {
          "source_id": "src_sg_seab_h2_math_9758_2026",
          "locator": "PDF p.7, sub-topic 2.1 Sequences and series"
        }
      ],
      "review_status": "approved"
    },
    {
      "practice_id": "practice_sg_h2_math_9758_2026_gc_derivative_extrema",
      "requirement_ids": [
        "req_sg_h2_math_9758_2026_o_gc_derivative_extrema"
      ],
      "kind": "assessment_task",
      "name": "Numerical derivatives and extrema with graphing technology",
      "name_zh": "用图形技术估计导数与极值",
      "description_zh": "用图形计算器或软件估计指定点导数并定位极值。",
      "instructional_use_zh": "先用图像估计导数或极值位置，再通过局部缩放、数值读数和解析导数进行交叉检查。",
      "assessment_evidence_zh": "报告的导数或极值位置有适当精度，并附图像、区间或解析依据；能区分局部极值、端点和显示伪影。",
      "evidence_refs": [
        {
          "source_id": "src_sg_seab_h2_math_9758_2026",
          "locator": "PDF p.9, sub-topic 5.1 Differentiation"
        }
      ],
      "review_status": "approved"
    },
    {
      "practice_id": "practice_sg_h2_math_9758_2026_definite_integral_technology",
      "requirement_ids": [
        "req_sg_h2_math_9758_2026_o_definite_integral_technology"
      ],
      "kind": "assessment_task",
      "name": "Approximating definite integrals with technology",
      "name_zh": "使用图形技术近似定积分",
      "description_zh": "使用图形计算器或绘图软件获得定积分近似值并检查合理性。",
      "instructional_use_zh": "在数值积分前先判断积分号、区间和预期符号或数量级，再用图形技术计算并与面积或解析结果核对。",
      "assessment_evidence_zh": "输入的被积函数和上下限正确，近似值精度合理；符号、数量级和必要的面积解释能够相互验证。",
      "evidence_refs": [
        {
          "source_id": "src_sg_seab_h2_math_9758_2026",
          "locator": "PDF p.10, sub-topic 5.4 Definite integrals"
        }
      ],
      "review_status": "approved"
    }
  ]
}
